{"$schema":"https://json-schema.org/draft/2020-12/schema","type":"object","required":["project_id","question","sources","method","preregistration","execution","evidence","impact","feedback","state","hash"],"properties":{"project_id":{"type":"string"},"question":{"type":"string"},"sources":{"type":"array"},"method":{"type":"object"},"preregistration":{"type":"object"},"execution":{"type":"object"},"evidence":{"type":"array"},"impact":{"type":"object"},"feedback":{"type":"object"},"state":{"type":"string"},"hash":{"type":"object"}}}
